{
  "schema_version": "2026-05-29",
  "document_type": "user_profile",
  "tenant_id": "tenant_demo",
  "user_id": "keithdecosta@gmail.com",
  "email": "keithdecosta@gmail.com",
  "display_name": "Keith De Costa",
  "first_name": "Keith",
  "last_name": "De Costa",
  "role": "user",
  "status": "active",
  "avatar": {
    "initials": "K",
    "background_color": "#514db3"
  },
  "profile_images": {
    "max_images": 10,
    "max_size_bytes": 10485760,
    "allowed_mime_types": ["image/png", "image/jpeg", "image/webp"],
    "images": []
  },
  "auth": {
    "provider": "cognito",
    "cognito_username": "keithdecosta@gmail.com",
    "email_verified": true,
    "mfa_enabled": false
  },
  "subscription": {
    "account_status": "inactive",
    "tier_id": "starter",
    "billing_status": "not_started",
    "activation_available": true
  },
  "created_at": 1780092000,
  "updated_at": 1780092000
}
